[
  {
    "schemaVersion": "0.2",
    "id": "bright-steps-ecd",
    "name": "Bright Steps ECD",
    "category": "ECD Centre",
    "location": {
      "area": "KwaMashu",
      "city": "Durban",
      "province": "KwaZulu-Natal"
    },
    "summary": "A fictional early learning centre in KwaMashu. Play-based sessions and school-readiness activities for ages 2 to 5. No children are enrolled through this demo.",
    "hours": "Weekdays 07:00–16:00",
    "offerings": [
      "Play-based sessions for ages 2 to 5",
      "School-readiness activities",
      "Visitor information about a fictional centre"
    ],
    "contact": {
      "label": "Demo enquiry only"
    },
    "fictional": true,
    "publication": {
      "status": "static-demo",
      "note": "Included in the fictional static demo. This is not a live public listing."
    },
    "profilePath": "/connect/bright-steps-ecd"
  },
  {
    "schemaVersion": "0.2",
    "id": "sindis-bakery",
    "name": "Sindi's Bakery",
    "category": "Bakery",
    "location": {
      "area": "Umlazi",
      "city": "Durban",
      "province": "KwaZulu-Natal"
    },
    "summary": "A fictional neighbourhood bakery in Umlazi. Bread, rolls and celebration cakes. This page is not an order form and not a real shop.",
    "hours": "Mon–Sat 06:00–17:00",
    "offerings": [
      "Daily bread and rolls",
      "Celebration cakes to order",
      "Weekday midday pies"
    ],
    "contact": {
      "label": "Demo enquiry only"
    },
    "fictional": true,
    "publication": {
      "status": "static-demo",
      "note": "Included in the fictional static demo. This is not a live public listing."
    },
    "profilePath": "/connect/sindis-bakery"
  },
  {
    "schemaVersion": "0.2",
    "id": "ubuntu-plumbing",
    "name": "Ubuntu Plumbing",
    "category": "Plumbing",
    "location": {
      "area": "Pietermaritzburg",
      "city": "Pietermaritzburg",
      "province": "KwaZulu-Natal"
    },
    "summary": "A fictional plumbing practice in Pietermaritzburg. Leak checks, blocked drains and geyser inspections. No call-out number is published and no trade licence is claimed.",
    "hours": "Weekdays 08:00–17:00",
    "offerings": [
      "Visible leak checks",
      "Blocked-drain clearing",
      "Geyser inspection"
    ],
    "contact": {
      "label": "Demo enquiry only"
    },
    "fictional": true,
    "publication": {
      "status": "static-demo",
      "note": "Included in the fictional static demo. This is not a live public listing."
    },
    "profilePath": "/connect/ubuntu-plumbing"
  }
]
